{
  "id": "greenhouse",
  "width": 16,
  "height": 12,
  "tileSize": 64,
  "spawn": {
    "x": 1,
    "y": 6
  },
  "blocked": [
    [
      0,
      0
    ],
    [
      1,
      0
    ],
    [
      2,
      0
    ],
    [
      3,
      0
    ],
    [
      4,
      0
    ],
    [
      5,
      0
    ],
    [
      6,
      0
    ],
    [
      7,
      0
    ],
    [
      8,
      0
    ],
    [
      9,
      0
    ],
    [
      10,
      0
    ],
    [
      11,
      0
    ],
    [
      12,
      0
    ],
    [
      13,
      0
    ],
    [
      14,
      0
    ],
    [
      15,
      0
    ],
    [
      0,
      1
    ],
    [
      15,
      1
    ],
    [
      0,
      2
    ],
    [
      15,
      2
    ],
    [
      0,
      3
    ],
    [
      15,
      3
    ],
    [
      0,
      4
    ],
    [
      15,
      4
    ],
    [
      0,
      5
    ],
    [
      15,
      5
    ],
    [
      15,
      6
    ],
    [
      0,
      7
    ],
    [
      15,
      7
    ],
    [
      0,
      8
    ],
    [
      15,
      8
    ],
    [
      0,
      9
    ],
    [
      15,
      9
    ],
    [
      0,
      10
    ],
    [
      15,
      10
    ],
    [
      0,
      11
    ],
    [
      1,
      11
    ],
    [
      2,
      11
    ],
    [
      3,
      11
    ],
    [
      4,
      11
    ],
    [
      5,
      11
    ],
    [
      6,
      11
    ],
    [
      7,
      11
    ],
    [
      8,
      11
    ],
    [
      9,
      11
    ],
    [
      10,
      11
    ],
    [
      11,
      11
    ],
    [
      12,
      11
    ],
    [
      13,
      11
    ],
    [
      14,
      11
    ],
    [
      15,
      11
    ]
  ],
  "interactPoints": [
    {
      "id": "greenhouse_door",
      "x": 8,
      "y": 6
    }
  ],
  "portals": [
    {
      "x": 0,
      "y": 6,
      "targetZone": "cottage",
      "targetX": 22,
      "targetY": 9,
      "unlockFlag": null
    }
  ],
  "plots": [],
  "debris": []
}
