{
  "id": "cottage",
  "width": 24,
  "height": 18,
  "tileSize": 64,
  "spawn": {
    "x": 12,
    "y": 15
  },
  "blocked": [
    [
      0,
      0
    ],
    [
      1,
      0
    ],
    [
      2,
      0
    ],
    [
      3,
      0
    ],
    [
      4,
      0
    ],
    [
      5,
      0
    ],
    [
      6,
      0
    ],
    [
      7,
      0
    ],
    [
      8,
      0
    ],
    [
      9,
      0
    ],
    [
      10,
      0
    ],
    [
      11,
      0
    ],
    [
      12,
      0
    ],
    [
      13,
      0
    ],
    [
      14,
      0
    ],
    [
      15,
      0
    ],
    [
      16,
      0
    ],
    [
      17,
      0
    ],
    [
      18,
      0
    ],
    [
      19,
      0
    ],
    [
      20,
      0
    ],
    [
      21,
      0
    ],
    [
      22,
      0
    ],
    [
      23,
      0
    ],
    [
      0,
      1
    ],
    [
      23,
      1
    ],
    [
      0,
      2
    ],
    [
      23,
      2
    ],
    [
      0,
      3
    ],
    [
      23,
      3
    ],
    [
      0,
      4
    ],
    [
      23,
      4
    ],
    [
      0,
      5
    ],
    [
      23,
      5
    ],
    [
      0,
      6
    ],
    [
      23,
      6
    ],
    [
      0,
      7
    ],
    [
      23,
      7
    ],
    [
      0,
      8
    ],
    [
      23,
      8
    ],
    [
      0,
      9
    ],
    [
      0,
      10
    ],
    [
      23,
      10
    ],
    [
      0,
      11
    ],
    [
      23,
      11
    ],
    [
      0,
      12
    ],
    [
      23,
      12
    ],
    [
      0,
      13
    ],
    [
      23,
      13
    ],
    [
      0,
      14
    ],
    [
      23,
      14
    ],
    [
      0,
      15
    ],
    [
      23,
      15
    ],
    [
      0,
      16
    ],
    [
      23,
      16
    ],
    [
      0,
      17
    ],
    [
      1,
      17
    ],
    [
      2,
      17
    ],
    [
      3,
      17
    ],
    [
      4,
      17
    ],
    [
      5,
      17
    ],
    [
      6,
      17
    ],
    [
      7,
      17
    ],
    [
      8,
      17
    ],
    [
      9,
      17
    ],
    [
      10,
      17
    ],
    [
      11,
      17
    ],
    [
      12,
      17
    ],
    [
      13,
      17
    ],
    [
      14,
      17
    ],
    [
      15,
      17
    ],
    [
      16,
      17
    ],
    [
      17,
      17
    ],
    [
      18,
      17
    ],
    [
      19,
      17
    ],
    [
      20,
      17
    ],
    [
      21,
      17
    ],
    [
      22,
      17
    ],
    [
      23,
      17
    ],
    [
      3,
      3
    ],
    [
      4,
      3
    ],
    [
      5,
      3
    ],
    [
      6,
      3
    ],
    [
      7,
      3
    ],
    [
      8,
      3
    ],
    [
      3,
      4
    ],
    [
      4,
      4
    ],
    [
      5,
      4
    ],
    [
      6,
      4
    ],
    [
      7,
      4
    ],
    [
      8,
      4
    ],
    [
      3,
      5
    ],
    [
      4,
      5
    ],
    [
      5,
      5
    ],
    [
      6,
      5
    ],
    [
      7,
      5
    ],
    [
      8,
      5
    ],
    [
      3,
      6
    ],
    [
      4,
      6
    ],
    [
      5,
      6
    ],
    [
      6,
      6
    ],
    [
      7,
      6
    ],
    [
      8,
      6
    ]
  ],
  "interactPoints": [
    {
      "id": "house",
      "x": 6,
      "y": 7
    },
    {
      "id": "well",
      "x": 15,
      "y": 5
    },
    {
      "id": "lily",
      "x": 14,
      "y": 12
    },
    {
      "id": "gate",
      "x": 22,
      "y": 9
    }
  ],
  "portals": [
    {
      "x": 23,
      "y": 9,
      "targetZone": "greenhouse",
      "targetX": 1,
      "targetY": 6,
      "unlockFlag": "greenhouse_exterior"
    }
  ],
  "plots": [
    {
      "id": "plot_01",
      "x": 9,
      "y": 8,
      "unlockFlag": null
    },
    {
      "id": "plot_02",
      "x": 10,
      "y": 8,
      "unlockFlag": null
    },
    {
      "id": "plot_03",
      "x": 11,
      "y": 8,
      "unlockFlag": null
    },
    {
      "id": "plot_04",
      "x": 12,
      "y": 8,
      "unlockFlag": null
    },
    {
      "id": "plot_05",
      "x": 9,
      "y": 9,
      "unlockFlag": "fence_repaired"
    },
    {
      "id": "plot_06",
      "x": 10,
      "y": 9,
      "unlockFlag": "fence_repaired"
    },
    {
      "id": "plot_07",
      "x": 11,
      "y": 9,
      "unlockFlag": "fence_repaired"
    },
    {
      "id": "plot_08",
      "x": 12,
      "y": 9,
      "unlockFlag": "fence_repaired"
    }
  ],
  "debris": [
    {
      "id": "debris_01",
      "x": 2,
      "y": 8,
      "toolLevel": 1,
      "blocksMovement": true,
      "yieldItems": {
        "wood": 3,
        "stone": 2
      }
    },
    {
      "id": "debris_02",
      "x": 2,
      "y": 10,
      "toolLevel": 1,
      "blocksMovement": true,
      "yieldItems": {
        "wood": 3,
        "stone": 2
      }
    },
    {
      "id": "debris_03",
      "x": 3,
      "y": 12,
      "toolLevel": 1,
      "blocksMovement": true,
      "yieldItems": {
        "wood": 3,
        "stone": 2
      }
    },
    {
      "id": "debris_04",
      "x": 5,
      "y": 10,
      "toolLevel": 1,
      "blocksMovement": true,
      "yieldItems": {
        "wood": 3,
        "stone": 2
      }
    },
    {
      "id": "debris_05",
      "x": 7,
      "y": 11,
      "toolLevel": 1,
      "blocksMovement": true,
      "yieldItems": {
        "wood": 3,
        "stone": 2
      }
    },
    {
      "id": "debris_06",
      "x": 15,
      "y": 8,
      "toolLevel": 1,
      "blocksMovement": true,
      "yieldItems": {
        "wood": 3,
        "stone": 2
      }
    },
    {
      "id": "debris_07",
      "x": 18,
      "y": 10,
      "toolLevel": 1,
      "blocksMovement": true,
      "yieldItems": {
        "wood": 3,
        "stone": 2
      }
    },
    {
      "id": "debris_08",
      "x": 20,
      "y": 12,
      "toolLevel": 1,
      "blocksMovement": true,
      "yieldItems": {
        "wood": 3,
        "stone": 2
      }
    },
    {
      "id": "debris_09",
      "x": 16,
      "y": 14,
      "toolLevel": 1,
      "blocksMovement": true,
      "yieldItems": {
        "wood": 3,
        "stone": 2
      }
    },
    {
      "id": "debris_10",
      "x": 4,
      "y": 14,
      "toolLevel": 1,
      "blocksMovement": true,
      "yieldItems": {
        "wood": 3,
        "stone": 2
      }
    }
  ]
}
